,Publication,Date,Title,Content
4,ilPost,2024-09-25,L’Unione Europea è più vicina a ridurre la protezione dei lupi,"Mercoledì 25 settembre, a Bruxelles, il Comitato dei rappresentanti permanenti dei paesi dell’Unione Europea, il COREPER, ha votato a favore di una proposta della Commissione Europea per cambiare il grado di protezione dei lupi: attualmente sono una specie «particolarmente protetta», se la proposta sarà definitivamente approvata diventeranno una specie solo «protetta». Secondo una fonte diplomatica anonima citata dall’agenzia di stampa AFP, solo due rappresentanti su 27 hanno votato contro. Affinché il voto di oggi sia ufficiale dovrà essere confermato dai ministri dell’Ambiente dei paesi membri, ma si tratta di una formalità. Negli ultimi decenni il numero dei lupi in Unione Europea è aumentato significativamente. Questo è considerato un successo delle iniziative per la protezione della specie; negli ultimi anni tuttavia è stato anche l’oggetto di molte proteste da parte degli allevatori europei che, in alcune regioni, hanno subito perdite economiche a causa degli attacchi dei lupi a greggi e mandrie. Riducendo il grado di protezione dei lupi sarà possibile autorizzare più facilmente le uccisioni di questi animali: al momento possono essere uccisi solo nei casi in cui siano considerati problematici per la sicurezza di animali domestici e persone, mentre se fossero una specie semplicemente «protetta» la caccia sarebbe consentita sotto alcune rigide restrizioni. Il lupo (Canis lupus) è una specie «particolarmente protetta» nei paesi dell’Unione Europea sulla base della Convenzione di Berna, un accordo internazionale europeo in vigore dal 1982 e riguarda anche paesi che non sono membri dell’Unione. L’impegno a conservare la specie venne preso perché negli anni Sessanta, dopo due secoli di caccia intensiva, la popolazione europea di questi animali si era praticamente estinta, soprattutto nei paesi più a ovest. Da allora il numero di lupi presenti in Europa è tornato a crescere. Per esempio in Italia, secondo la prima e più recente stima nazionale, risalente al 2022, ce ne sarebbero circa 3.300. Nell’intera Unione Europea i lupi dovrebbero essere circa 20.300. Se il voto sarà confermato dai ministri dell’Ambiente europei, l’Unione potrà chiedere una revisione della Convenzione di Berna durante una riunione internazionale prevista per dicembre: per modificarne il testo serve una maggioranza di due terzi, quindi di almeno 33 dei 50 paesi firmatari – quelli membri dell’Unione sono 27. Se poi la Convenzione sarà modificata si potrà cambiare la direttiva europea che ne dipende e di conseguenza le leggi nazionali associate. Il portavoce della Commissione Europea Adalbert Jahnz ha detto che «adattare il livello di protezione sarà un passo importante per affrontare le sfide legate a una popolazione di lupi in aumento mantenendo l’obiettivo generale di ottenere la conservazione della specie». La rivalutazione della protezione dei lupi è comunque osteggiata da un gran numero di scienziati che si occupano di conservazione degli animali e da organizzazioni ambientaliste come il WWF."
5,ilPost,2024-09-25,Tra i più ampi e distruttivi bombardamenti della storia recente,"Negli scorsi giorni, e in particolare lunedì, Israele ha attaccato massicciamente il gruppo libanese Hezbollah e compiuto alcuni dei bombardamenti più ampi e distruttivi degli ultimi decenni, non soltanto in Medio Oriente. Per numero delle persone uccise e ferite – al momento i morti sono più di 500, in soli due giorni – i bombardamenti in Libano sono stati tra i più mortali del Ventunesimo secolo. L’anno scorso nella Striscia di Gaza ci vollero 18 giorni di bombardamenti perché il numero delle persone uccise superasse i 500; i bombardamenti russi in Ucraina non hanno mai ucciso 500 persone nemmeno in un mese, e durante l’ultima guerra tra Israele e Hezbollah, nel 2006, il numero dei morti fu di oltre 1.000 persone, ma in 34 giorni. Il numero delle persone uccise in Libano è fornito dal ministero della Salute libanese, che non è controllato da Hezbollah ed è ritenuto a livello internazionale un’istituzione affidabile da questo punto di vista. Israele sostiene di aver colpito migliaia di obiettivi militari appartenenti a Hezbollah, ma spesso l’ha fatto in zone densamente abitate, e secondo il ministero della Salute libanese tra i morti ci sono moltissimi civili. Israele sostiene che Hezbollah utilizzi i civili come «scudi umani»: il primo ministro Benjamin Netanyahu ha detto che in Libano ci sono persone che tengono «un missile in salotto e un razzo in cantina». Il Libano accusa invece Israele di compiere bombardamenti indiscriminati. Questi bombardamenti – a cui Hezbollah ha sempre risposto lanciando razzi contro Israele – hanno colpito soprattutto il sud del Libano, dove Hezbollah è più forte e dove gli scontri vanno avanti da mesi, ma hanno devastato e provocato grossi danni anche in zone del paese che finora erano state parzialmente risparmiate dagli scontri, come la capitale Beirut. Qui sotto c’è un elenco delle zone più colpite, e degli effetti dei bombardamenti. Il Libano del sud
Il grosso dei bombardamenti israeliani si è concentrato nella parte meridionale del Libano, dove da mesi Hezbollah e l’esercito israeliano si affrontano a distanza con lanci di missili e razzi. Israele sostiene di avere cominciato a bombardare più intensamente il sud del Libano con l’obiettivo esplicito di mettere in sicurezza dai razzi di Hezbollah le proprie comunità a nord, a ridosso con il confine libanese: per questo il grosso dei bombardamenti si è concentrato nell’area a nord del confine. L’area a ridosso del confine si è spopolata da mesi a causa dei bombardamenti continui: più di 60 mila persone israeliane e più di 90 mila persone libanesi sono state costrette a lasciare le proprie case. Ma i bombardamenti israeliani nel sud del Libano si sono spinti ben oltre la zona evacuata, verso insediamenti e città dove i civili avevano continuato a vivere perché non erano stati mai o quasi mai toccati dai bombardamenti finora. Per esempio Israele ha colpito le città di Tiro, Sidone e Nabatieh, dove vivono centinaia di migliaia di persone. Dopo i bombardamenti israeliani il numero degli sfollati in Libano è aumentato: ora si parla di 500 mila persone. La valle della Beqa
Fino a lunedì, i bombardamenti di Israele nel Libano non si erano spinti più a nord di Baalbek, un’antica cittadina che si trova a circa 50 chilometri dal confine e che ospita notevoli rovine ellenistiche e romane. Baalbek si trova nella valle della Beqa (nota in inglese come Bekaa Valley), un’area fertile nell’est del paese, ed era stata bombardata più volte negli scorsi mesi, ma lunedì ha subìto bombardamenti molto più gravi. Lunedì a Baalbek il giornalista libanese Fadi Boudia si trovava in diretta streaming con un canale tv iracheno quando la sua casa è stata colpita da un bombardamento (il video qui sotto è abbastanza impressionante). Lunedì bombardamenti israeliani si sono però spinti molto più a nord e sono arrivati fino alla città di Hermel, che si trova a circa 120 chilometri dal confine con Israele (il Libano in tutto misura longitudinalmente circa 200 chilometri). Beirut
Israele ha colpito con bombardamenti anche la capitale del Libano, Beirut. In particolare ha colpito la periferia e l’area a sud, dove Hezbollah è da sempre molto forte e ha notoriamente il controllo del territorio. I bombardamenti contro Beirut non sono stati troppo intensi, ma hanno comunque provocato molti morti e feriti. Nel video qui sotto si vede un bombardamento a Jiyeh, una cittadina una ventina di chilometri a sud di Beirut. In città Israele ha colpito il quartiere di Dahiya, nella parte sud. Nel video qui sotto si vede l’impatto di un bombardamento. A Dahiya, martedì, Israele ha anche ucciso con un bombardamento Ibrahim Muhammad Qubaisi, un importante comandante militare di Hezbollah. La risposta di Hezbollah
Hezbollah ha risposto ai bombardamenti israeliani lanciando centinaia di razzi contro il territorio di Israele, che però sono stati in gran parte intercettati dal sistema di difesa Iron Dome, che lancia missili contro i razzi e li fa esplodere in aria. Alcuni dei razzi sono comunque riusciti a colpire il proprio obiettivo, provocando alcuni danni. I razzi di Hezbollah sono stati intercettati fino a Haifa, una città a circa 30 chilometri dal confine, che Hezbollah aveva già tentato di colpire la settimana scorsa. Mercoledì Hezbollah ha cercato di colpire anche Tel Aviv con un razzo, che poi è stato intercettato. Sette persone sono state ferite, nessuno è stato ucciso. Nel video qui sotto i danni provocati da un razzo che ha colpito domenica a nord di Haifa.     "
6,ilPost,2024-09-25,In Giappone le donne sposate potranno tenersi il loro cognome?,"Venerdì 27 settembre il Partito Liberal Democratico (PLD) del Giappone voterà per eleggere il suo nuovo leader, che diventerà automaticamente il nuovo primo ministro del paese al posto di Fumio Kishida, diventato molto impopolare. I candidati sono 9, sette uomini e due donne, e hanno posizioni simili sotto molti aspetti. C’è tuttavia un tema su cui sono divisi: la possibilità di cambiare la legge in base alla quale le donne che si sposano prendono il cognome del marito. È una questione superficialmente poco concreta che però è indicativa di un più ampio e importante aspetto della società giapponese, cioè la subordinazione delle donne agli uomini in molti contesti sociali, dalla famiglia al lavoro. La regola sui cognomi è quindi diventata un simbolo di varie altre disparità, anche perché è una peculiarità giapponese: secondo il governo non ci sono altri paesi con una legge analoga. Anche se è improbabile che questo tema sia dirimente per la scelta del nuovo primo ministro, il dibattito in proposito segna una divisione generazionale all’interno del PLD. L’elezione di un leader con una posizione più progressista potrebbe indicare un periodo di maggiore apertura al cambiamento di un partito che in generale è molto conservatore. Il PLD governa il Giappone quasi ininterrottamente dal 1955. La legge per cui le donne cambiano il proprio cognome dopo il matrimonio risale alla cosiddetta era Meiji, il periodo in cui regnò l’imperatore Mutsuhito, dal 1867 al 1912. Tecnicamente non obbliga le donne ad abbandonare il cognome di nascita per adottare quello del marito, ma stabilisce che le coppie sposate debbano usare lo stesso cognome. Nei fatti tuttavia sono quasi sempre le donne a rinunciare al proprio: secondo un’indagine del 2022 commissionata dal governo, è quello che succede nel 95 per cento dei casi. È dal 1996 che nella politica giapponese si discute della possibilità di modificare la legge sul cognome delle coppie sposate: in quell’anno una commissione del ministero della Giustizia suggerì di fare una revisione del codice civile in modo da modificare il sistema dei cognomi. Secondo i sondaggi dei media giapponesi, attualmente circa due terzi della popolazione sarebbero favorevoli a una riforma. Già in due occasioni la Corte Suprema giapponese ha chiesto al parlamento di legiferare sul tema, dopo che le erano stati presentati i casi di persone che avrebbero voluto cambiare cognome. Un terzo caso, che coinvolge 6 coppie, è attualmente sotto esame in tribunale. Tra le coppie che hanno fatto ricorso contro la legge ci sono Yukari Uchiyama e il suo compagno Yukio Koike, che hanno 56 e 66 anni: dal 1991 si sono sposati e hanno divorziato tre volte per far sì che i loro figli potessero essere riconosciuti come legittimi e avere lo stesso cognome e al tempo stesso Uchiyama potesse mantenere il proprio cognome originale. Uchiyama ha detto che rinunciare al proprio cognome l’aveva fatta sentire come se la sua stessa «esistenza, il fondamento dei miei diritti come essere umano, fosse ignorata, o tagliata alle radici» e che «quando anche qualcosa di così semplice non cambia, varie questioni di genere che vengono sollevate non sono riconosciute». Lo scorso giugno aveva preso posizione sul tema anche la Keidanren, un’associazione che comprende molte imprese analoga alla Confindustria italiana, chiedendo che il sistema attuale fosse modificato. Nella vita professionale molte donne continuano a usare il cognome da nubili anche dopo il matrimonio per praticità, e la maggior parte delle aziende lo consente, ma la discrepanza tra il nome sui documenti e quello utilizzato può creare dei problemi, ad esempio nei viaggi di lavoro all’estero. All’interno del Partito Liberal Democratico tuttavia è ancora molto diffusa l’idea che modificare la legge sui cognomi delle coppie sposate indebolirebbe i «valori familiari» giapponesi e l’unità delle famiglie. Tra i membri del partito contrari a cambiare le cose c’è Sanae Takaichi, che è la ministra della Sicurezza economica e una delle due donne candidate a prendere il posto di Kishida. Takaichi ha 63 anni e se fosse eletta diventerebbe la prima donna a guidare il governo del Giappone nella sua storia. Ha dichiarato che sebbene sia favorevole all’uso di cognomi diversi nei contesti lavorativi ritiene che l’uso di un unico cognome all’interno delle coppie sposate eviti una forma di confusione che potrebbe creare problemi agli eventuali figli delle coppie. L’attuale ministra degli Esteri Yoko Kamikawa, che ha 71 anni ed è l’altra donna candidata, ha invece evitato di esprimersi sulla questione in modo perentorio, dicendo che serve un maggiore dibattito sul tema. Ha comunque detto di «riconoscere il rischio di divisioni» sull’argomento. Anche il 67enne Shigeru Ishiba, il candidato con maggiore consenso nei sondaggi d’opinione, ha idee simili. Ha invece una posizione più progressista l’ex ministro dell’Ambiente Shinjiro Koizumi, uno degli altri candidati. Koizumi è figlio di Junichiro Koizumi, primo ministro del Giappone tra il 2001 e il 2006, e ha 43 anni: è il più giovane dei nove candidati alla guida del PLD. È anche l’unico candidato a essersi impegnato a cambiare la legge sui cognomi delle coppie sposate e ha promesso di farlo nel suo primo anno da primo ministro, se sarà scelto alla guida del partito. Nel 2020 Koizumi si era già fatto notare per aver preso un breve congedo di paternità dopo la nascita del suo primo figlio, una cosa che in Giappone fanno pochissimi uomini. Facendo una promessa esplicita su una questione di parità di genere Koizumi si è distinto dagli altri candidati. Takaichi invece ha detto di avere un punto di vista opposto rinsaldando di fatto il proprio legame con la fazione più a destra del partito nella ricerca di consenso degli elettori più anziani. L’attuale primo ministro Fumio Kishida è in carica dall’ottobre del 2021. Il consenso nei suoi confronti era molto diminuito a causa del coinvolgimento del suo governo in una serie di scandali, il più recente e più grave dei quali riguarda presunti fondi raccolti in maniera irregolare da membri influenti del Partito Liberal Democratico e aveva portato alle dimissioni di importanti esponenti del partito, tra cui diversi ministri e parlamentari. Secondo le accuse, alcuni membri della corrente Seiwakai, vicina all’ex primo ministro Shinzo Abe, non avrebbero dichiarato almeno 500 milioni di yen (circa 3,2 milioni di euro) ottenuti negli ultimi cinque anni negli eventi di raccolta fondi del partito, tenendone parte per sé. Ad agosto Kishida aveva annunciato che non si sarebbe candidato per il rinnovo della leadership del partito. A votare per scegliere il successore o la successora di Kishida saranno i parlamentari del Partito Liberal Democratico insieme a membri del partito eletti nelle prefetture, gli enti amministrativi in cui è diviso il territorio del Giappone."
7,ilPost,2024-09-25,Come si ottiene la cittadinanza negli altri paesi europei,"Martedì la proposta di referendum che vorrebbe dimezzare il periodo necessario di residenza in Italia per poter presentare la domanda di cittadinanza italiana, da 10 a 5 anni, ha raggiunto le 500mila firme, cioè la soglia minima necessaria affinché il quesito venga sottoposto alla Corte Costituzionale. Sul suo sito il comitato promotore del referendum scrive che la proposta «allineerebbe l’Italia alla maggioranza delle normative europee», e in effetti è vero: in gran parte dei paesi dell’Europa occidentale per diventare cittadini servono circa cinque anni, contro i dieci che al momento occorrono in Italia. La maggioranza di destra attualmente al governo è contraria alla proposta, e a sostegno della propria posizione cita spesso il fatto che l’Italia è il paese europeo che in assoluto “naturalizza” – cioè garantisce la cittadinanza – il maggior numero di persone: nel 2022 secondo i dati di Eurostat, l’agenzia statistica dell’Unione Europea, sono state circa 213mila, circa una su quattro del totale delle cittadinanze date nell’Unione Europea. L’Italia però è quinta per numero di cittadinanze garantite in proporzione alla popolazione. Inoltre le norme italiane prevedono percorsi piuttosto disomogenei. Per alcune categorie di persone sono agevolati: per esempio le leggi italiane sui ricongiungimenti familiari sono piuttosto permissive. Per altre categorie sono invece molto più complessi: è il caso dei lavoratori che si trovano da anni in Italia ma che non sono sposati con una persona italiana, o non sono parenti di qualcuno che ha già la cittadinanza. Anche in altri paesi europei sono previsti percorsi più facili per i coniugi o i figli di persone che hanno ottenuto la cittadinanza, più o meno larghi: il percorso ordinario per ottenere la cittadinanza in assenza di legami è comunque più breve che in Italia. In Francia per diventare cittadini serve aver vissuto per cinque anni nel paese senza interruzioni, avere un impiego o una fonte di reddito stabile e superare un esame scritto e orale di francese che attesti una conoscenza a livello B1 del Quadro comune europeo di riferimento per la conoscenza delle lingue (significa conoscere una lingua a un livello intermedio, su una scala che va da A1 a C2). Alla fine del percorso bisogna anche superare un esame di conoscenza della storia francese. Il percorso si può interrompere in ogni momento in caso di una condanna per reati di terrorismo o a una pena di almeno sei mesi di carcere senza la condizionale. Nel 2022, ultimo anno per cui sono disponibili questi dati, in Francia hanno ottenuto la cittadinanza circa 114mila persone.  Anche in Germania per diventare cittadini servono cinque anni di soggiorno nel paese, per effetto di una legge approvata dall'attuale governo di centrosinistra ed entrata in vigore a giugno. In precedenza servivano otto anni di residenza. Anche lo stato tedesco richiede un impiego o un reddito stabile e una conoscenza a livello B1 del tedesco, mentre alcuni parametri sono più restrittivi rispetto a quelli francesi: non può ottenere la cittadinanza chi ha ottenuto una condanna penale, di qualsiasi entità. Dopo l'entrata in vigore della nuova legge la ministra dell'Interno tedesca, Nancy Faeser, ha celebrato l'accorciamento dei tempi, dicendo che «finalmente riconosciamo le storie di vita e i successi delle molte persone che sono arrivate nel nostro paese tempo fa e lo hanno aiutato a svilupparsi». Nel 2022, ultimo anno per cui sono disponibili dati solidi, in Germania hanno ottenuto la cittadinanza circa 166mila persone. Il secondo paese che da qualche anno garantisce il numero più alto di cittadinanze è la Spagna. Qui per ottenere la cittadinanza col percorso ordinario sono necessari dieci anni di residenza, ma una clausola molto sfruttata li riduce ad appena due per le persone nate nei paesi dell'America Latina in cui si parla spagnolo, o in altri paesi parzialmente ispanofoni come le Filippine e la Guinea Equatoriale. Anche in Spagna per ottenere la cittadinanza serve un esame di lingua e di conoscenze della storia spagnola, elaborato dall'Instituto Cervantes, l'ente dello stato spagnolo che promuove la lingua e la cultura spagnola all'estero. Nel 2022 la Spagna ha garantito la cittadinanza a circa 181mila persone. In Austria gli anni necessari di residenza sono invece sei, durante i quali per almeno 36 mesi bisogna dimostrare di avere avuto un reddito stabile (obbligatorio per i 6 mesi precedenti la richiesta). I requisiti sui rapporti con la giustizia sono più stretti che altrove: non bisogna aver ricevuto una condanna penale, ma lo stato austriaco non garantisce la cittadinanza nemmeno alle persone straniere incriminate in attesa di un processo. In Irlanda invece gli anni richiesti di residenza sono almeno 5 negli ultimi 9, con almeno un anno continuativo di residenza nel periodo immediatamente precedente alla richiesta. Anche nei Paesi Bassi servono cinque anni di residenza, che però devono essere continuativi. Il paese dell'Unione Europea che garantisce il numero più alto di cittadinanze in rapporto alla propria popolazione è la Svezia: nel 2022 ha garantito la cittadinanza svedese a 8,8 persone ogni mille abitanti, il dato più alto in tutta l'Unione. Anche in Svezia per diventare cittadini servono almeno 5 anni di residenza: non sono richiesti però esami di lingua o di storia svedese. Anche le persone condannate per un reato penale o amministrativo possono ottenere la cittadinanza, ma devono attendere un periodo di tempo più lungo indicato da apposite tabelle. Esistono poi percorsi semplificati per ottenere la cittadinanza svedese se si è cittadini di altri paesi nordici come Danimarca, Finlandia, Islanda e Norvegia (questi ultimi due paesi non fanno parte dell'Unione Europea). Ci sono altri paesi dell'Unione Europea in cui è ancora più facile ottenere la cittadinanza, se si è molto ricchi: per questo vengono criticati da anni per i loro criteri troppo larghi, che combinati a norme fiscali piuttosto rilassate li rendono delle specie di paradisi fiscali. A Malta per esempio si può ottenere la cittadinanza maltese – e quindi europea – in un anno, a patto di avere fatto un «investimento diretto» di almeno 750mila euro nell'economia locale. Ci sono percorsi agevolati anche per chi acquista o affitta una casa e va ad abitarci: basta che abbia valore minimo di 700mila euro o un canone annuo di almeno 16mila euro. Dall'altra parte dello spettro ci sono invece i paesi dell'Europa orientale, tradizionalmente molto ostili alla migrazione non europea per ragioni storiche e culturali. Uno tra i paesi dell'Unione Europea a garantire in assoluto meno nuove cittadinanze in proporzione ai propri abitanti è la Slovacchia: nel 2022 sono state circa 700. Per diventare cittadini slovacchi servono otto anni di residenza in Slovacchia – così come in Ungheria – e un'ottima conoscenza dello slovacco (una lingua parlata da circa 5 milioni di persone, più o meno quelle che abitano in Veneto). I principali paesi di provenienza delle persone che nel 2022 hanno ottenuto la cittadinanza da un paese dell'Unione Europea sono gli stessi ormai da anni. Il paese primo in questa classifica è il Marocco: nel 2022 sono diventati cittadini europei circa 112mila persone marocchine. La metà di loro ha ottenuto la cittadinanza in Spagna, circa un quarto in Italia. Seguono poi i siriani (90mila), gli albanesi (50mila, di cui tre quarti in Italia), romeni (37mila) e turchi (29mila, metà dei quali in Germania). In Italia circa un decimo delle persone a cui nel 2022 è stata data la cittadinanza – 21.280 – provengono da Argentina e Brasile; è possibile che siano insomma parenti alla lontana di migranti italiani che si trasferirono in Sudamerica decine di anni fa, e che possono chiedere e ottenere la cittadinanza italiana piuttosto facilmente per via dello ius sanguinis, senza bisogno di essere residenti in Italia."
