,Publication,Date,Title,Content
0,ilPost,2024-09-25,Il disegno di legge sulla sicurezza è pieno di nuovi reati,"Lo scorso 18 settembre la Camera dei deputati ha approvato il cosiddetto “ddl Sicurezza”, un disegno di legge molto pubblicizzato dal governo che introduce un numero eccezionale di nuovi reati e inasprimenti di pene: sui 38 articoli di cui si compone, sono almeno 20 quelli che prevedono l’introduzione di nuovi reati o l’estensione della loro applicabilità, aumento delle pene e delle sanzioni, interpretazioni più restrittive di alcune norme penali. In particolare, com’è stato notato dal deputato del Partito Democratico Matteo Mauri, nel provvedimento ci sono «almeno 14 articoli in cui si aumentano i reati e almeno 13 articoli in cui si aumentano le pene». È un numero altissimo persino per un governo come quello di Giorgia Meloni, che fin dal suo insediamento ha risposto sistematicamente a una gran varietà di problemi in questo modo, e cioè con l’introduzione di nuovi reati o aggravando le pene di quelli già esistenti: un atteggiamento che è già stato definito “populismo penale”, o panpenalismo. Finora i reati introdotti dal governo di Meloni sono stati una quindicina: dai cosiddetti “raduni pericolosi” al reato che sanziona le attività degli scafisti «lungo tutto il globo terracqueo», fino alla gestazione per altri considerata “reato universale” (una pratica che peraltro è già illegale in Italia). Il ddl Sicurezza ha generato un dibattito acceso in parlamento nelle ultime settimane, con le opposizioni che lo hanno criticato giudicandolo troppo repressivo. Persino nella coalizione di governo ci sono state perplessità da parte di Forza Italia. Il ministro della Giustizia Carlo Nordio, che pure aveva più volte promesso che il suo approccio sarebbe stato contrario all’introduzione di nuovi reati, finora è rimasto molto marginalizzato nel dibattito. Martedì il provvedimento è stato assegnato alla commissione Giustizia del Senato, dove dovrà essere analizzato e potrà subire ancora modifiche, anche se è piuttosto improbabile che ce ne siano di sostanziali. Poi dovrà essere approvato dalla Camera e dal Senato. Alcuni dei nuovi reati introdotti col disegno di legge riflettono battaglie elettorali su cui i partiti di destra hanno insistito molto negli ultimi tempi, altri non sembrano particolarmente necessari perché intervengono su condotte che sono già punite dal codice penale. L’articolo 10 prevede per esempio un nuovo reato, quello di «occupazione arbitraria di immobile destinato a domicilio altrui», con una pena che va dai 2 ai 7 anni di reclusione: la condotta che viene punita è quella di chi «mediante violenza o minaccia occupa o detiene senza titolo un immobile» o impedisce al legittimo proprietario di rientrarvi, cioè in sostanza l’occupazione di una casa, che in realtà era già sanzionata da tre articoli del codice penale (633, 633-bis e 634) che prevedono una pena da 1 a 3 anni di reclusione. Peraltro sullo stesso tema il governo di Giorgia Meloni era già intervenuto subito dopo il suo insediamento, nel novembre del 2022, col cosiddetto “decreto rave”, introducendo appunto l’articolo 633-bis che punisce con la reclusione da 3 a 6 anni chiunque «organizza o promuove l’invasione arbitraria di terreni o edifici altrui». Il fatto che il reato si aggiunga ad altri simili già esistenti e il tempismo con cui è stato annunciato hanno fatto pensare a molti che sia stato inserito nel disegno di legge per sfruttare il recente dibattito sull’occupazione delle case innescato dall’eurodeputata Ilaria Salis e mostrare attivismo su un tema caro a molti elettori conservatori. L’articolo 14 invece introduce di fatto il reato di blocco stradale, trasformando cioè da illecito amministrativo a illecito penale la condotta di chi interrompe il regolare traffico stradale o ferroviario col proprio corpo. Finora per effetto di una legge del 1948 – che era stata parzialmente inasprita dal primo governo di Giuseppe Conte nel 2018 tramite il cosiddetto “decreto Sicurezza” – per chi faceva questi blocchi stradali era prevista una multa da 1.000 a 4.000 euro: ora si vuole introdurre la pena di un mese di reclusione (e una multa fino a 300 euro), che però aumenta di entità – da 6 mesi a 2 anni – se il fatto è commesso da più persone riunite. È una norma, questa, pensata principalmente per disincentivare e punire le proteste fatte negli ultimi anni dagli attivisti ambientalisti di “Ultima Generazione”. Sempre nell’ambito dell’ordine pubblico connesso alla gestione delle manifestazioni, l’articolo 24 inasprisce le pene per il reato di deturpamento e imbrattamento di beni pubblici, quindi anche statue e monumenti, come successo più volte negli ultimi anni in casi molto discussi e spesso connessi alle proteste ambientaliste, particolarmente osteggiate dalla destra e non solo. Attualmente questi reati sono puniti con pene da 1 a 6 mesi reclusione e multe da 300 a 1.000 euro; nel disegno di legge invece è stata inserita una nuova fattispecie di reato che si applica ai casi in cui questi atti siano compiuti contro beni mobili e immobili adibiti a funzioni pubbliche (sedi di istituzioni, per esempio), con pene che vanno dai 6 ai 18 mesi di reclusione e con multe da 1.000 a 3.000 euro (e fino a 3 anni di reclusione e a 12.000 euro di multa in caso di recidiva). Sullo stesso tema è previsto un aumento delle pene anche per il danneggiamento (art. 635 del codice penale), che comprende varie pratiche solitamente fatte rientrare tra i cosiddetti “atti vandalici”, ugualmente usate in diverse proteste ambientaliste. Nel caso in cui queste azioni vengano fatte con minacce o violenze il ddl aumenta la pena fino a 5 anni di reclusione, e non più 3, e le multe possono arrivare fino a 15mila euro. C’è poi un altro nuovo reato, quello di «rivolta all’interno dell’istituto penitenziario», all’articolo 26 del disegno di legge: e anche questo è una specie di risposta ad avvenimenti recenti, visto che ultimamente ci sono state varie proteste di detenuti nelle carceri italiane dovute anche alle pessime condizioni in cui si trovano. Il reato prevede pene da 1 a 8 anni di reclusione (ma con aggravanti che arrivano fino a 20 anni) per chiunque promuova o organizzi una sommossa all’interno di un carcere, commettendo «atti di violenza o minaccia», tentando di evadere ma anche, più semplicemente, esercitando «resistenza, anche passiva, all’esecuzione degli ordini impartiti»: è una formulazione considerata potenzialmente molto problematica, perché potrebbe comprendere anche chi disobbedisca pacificamente agli agenti di polizia penitenziaria (atteggiamento per cui già oggi comunque sono previste sanzioni disciplinari per i detenuti). Anche in questo caso, il disegno di legge introduce un nuovo reato per una condotta che è già sanzionata dal codice penale all’articolo 415 («Istigazione a disobbedire alle leggi», con pene da 6 mesi a 5 anni di reclusione), che ora lo stesso articolo 26 aggrava ulteriormente aumentando la pena di un terzo proprio nei casi in cui il fatto sia commesso in un carcere. Lo stesso articolo, dunque, introduce una fattispecie specifica per le rivolte in carcere con un’aggravante rispetto a un reato già esistente, e introduce contestualmente un reato a parte che punisce in maniera ancor più grave una condotta sostanzialmente analoga. Con la stessa logica, l’articolo 27 introduce un nuovo reato per reprimere le rivolte violente messe in atto all’interno dei centri di trattenimento e di accoglienza per i migranti, anche questi spesso in condizioni degradanti: le pene vanno da 1 a 6 anni per chi promuove o organizza le rivolte (pure «mediante atti di resistenza anche passiva», come nel caso precedente), e da 1 a 4 anni per chi vi prende parte (ma con le aggravanti si può arrivare fino a 20 anni, se durante la rivolta qualcuno viene ucciso o subisce lesioni gravi). L’articolo 29 è stato invece considerato da alcuni esponenti delle opposizioni come la “norma anti-ong”, intese come le organizzazioni non governative che soccorrono i migranti nel mar Mediterraneo. Prevede infatti l’estensione e l’inasprimento di alcuni reati attualmente contemplati nel Codice della navigazione per i comandanti delle navi, italiane o straniere, che non rispettano ordini di alt o che commettono atti di resistenza o di ostilità verso le imbarcazioni della Guardia di finanza o di altre navi militari, con pene che vanno, a seconda dei casi, fino a 10 anni di reclusione. Ci sono diversi altri reati o aumenti di pena introdotti dal ddl Sicurezza. Gli articoli 19 e 20 per esempio aumentano le pene per i reati di lesioni, minaccia o resistenza a pubblico ufficiale; un altro le aumenta per chi sfrutta minorenni per chiedere l’elemosina (il cosiddetto “accattonaggio”). Vengono introdotti aggravanti di pena e una nuova fattispecie di reato per le truffe agli anziani e per alcuni reati connessi alle attività terroristiche; nuovi divieti e nuove sanzioni per l’importazione, la lavorazione e il commercio della cannabis, o per la vendita di schede telefoniche SIM senza una regolare identificazione del cliente che le acquista. E poi si introduce la facoltà di arrestare donne incinte o madri di figli di meno di un anno in specifiche strutture detentive a loro destinate: un provvedimento pensato per rispondere a un problema in realtà dalla diffusione molto limitata ma molto discusso, cioè quello delle borseggiatrici delle metropolitane delle grandi città che evitano il carcere perché incinte o con figli piccoli. Un altro reato (all’articolo 25) inasprisce le sanzioni e aumenta la decurtazione di punti dalla patente per chi non si ferma al segnale di stop della polizia stradale e un altro ancora (articolo 13) estende l’applicazione del “Daspo urbano”, cioè il divieto di accesso ad alcuni luoghi ritenuti sensibili (stazioni ferroviarie, cantieri, piazze che ospitano manifestazioni, eccetera) nei confronti di persone potenzialmente pericolose per l’ordine pubblico. Fu introdotto nel 2017 ed era già stato ampliato e inasprito nel 2018 con il cosiddetto decreto Sicurezza di Matteo Salvini, allora ministro dell’Interno. Ora verrebbe ulteriormente esteso: il questore può infatti disporlo anche nei confronti di chi sia stato anche solo denunciato (o condannato in via non definitiva) per una serie di reati contro la persona e contro il patrimonio.     "
1,ilPost,2024-09-25,In Messico è stata approvata la riforma della Guardia Nazionale,"Mercoledì il Senato del Messico ha approvato in via definitiva una contestata riforma della Guardia Nazionale, il corpo di polizia che il presidente Andrés Manuel López Obrador creò nel 2019 con il compito di contrastare i narcos e mantenere la pace sul territorio. Il punto più contestato della riforma, che era già stata approvata in prima lettura alla Camera, è quello che prevede di porre la Guardia Nazionale sotto il controllo del ministero della Difesa, e quindi dell’esercito. Non è solo una questione operativa: prevede anche di riformulare alcuni articoli della Costituzione abolendo il divieto di assegnare compiti non militari all’esercito al di fuori di un periodo di guerra. In pratica, consentirà alle forze armate di condurre operazioni di polizia o di sostituirsi a funzionari civili su richiesta del parlamento o del presidente. «È un passo gigantesco verso la militarizzazione del paese», ha scritto l’ex giudice della Corte Suprema José Ramón Cossío. È un parere diffuso anche tra i partiti di opposizione, secondo cui la riforma attribuirà un potere eccessivo all’esercito. Lo scorso anno, una sentenza della stessa Corte Suprema aveva peraltro stabilito l’incostituzionalità del trasferimento del controllo della Guardia Nazionale al ministero della Difesa. Il mandato di AMLO (così viene chiamato il presidente messicano, con un acronimo del suo nome completo) finirà il 30 settembre. Nell’ultima fase del suo incarico si è concentrato sul far approvare alcune contestate riforme che, tra le altre cose, rischiano di ridurre l’indipendenza dei magistrati e di depotenziare le agenzie che vigilano sull’operato del governo. Dall’1 ottobre il suo posto sarà preso da Claudia Sheinbaum, la presidente eletta a giugno che fa parte dello stesso partito di López Obrador (Morena). Anche se López Obrador non sarà più presidente, è praticamente certo che Sheinbaum porterà avanti le sue politiche e sosterrà le sue riforme. Dopo le elezioni di giugno lo schieramento presidenziale ha ottenuto la maggioranza sia alla Camera e al Senato – dove, controllando due terzi dei seggi, può modificare la Costituzione – sia in 27 dei 32 parlamenti statali, a cui spetta l’approvazione definitiva delle leggi. Sfruttando questa situazione particolarmente favorevole, negli ultimi mesi López Obrador era già riuscito a far approvare la riforma che ha reso elettive, e quindi maggiormente controllabili dal governo, le cariche dei giudici federali e della Corte Suprema. I sindacati e le associazioni di categoria, così come alcuni esperti di diritto, ritengono che il passaggio a un sistema elettivo – in cui i giudici devono candidarsi e fare campagna elettorale, in un paese con gravi problemi di corruzione – potrebbe avere l’effetto di politicizzare la magistratura e renderla più dipendente dal governo."
2,ilPost,2024-09-25,Israele sta bombardando il sud del Libano per il terzo giorno consecutivo,"Mercoledì sono andati avanti gli scontri tra Israele e il gruppo politico e militare libanese Hezbollah, che hanno interessato un’area sempre più ampia dei territori dei due stati: Israele ha colpito obiettivi libanesi più a nord, mentre Hezbollah ha lanciato un missile nel punto più a sud mai raggiunto prima. Gli attacchi vanno avanti da quasi un anno, ma da lunedì Israele ha intensificato enormemente il livello della violenza, mettendo in atto contro il Libano alcuni dei bombardamenti più distruttivi degli ultimi anni, al punto che si è cominciato a parlare di una possibile invasione di terra da parte di Israele. Mercoledì pomeriggio il generale Herzi Halevi, capo di stato maggiore dell’esercito israeliano, ha detto durante una visita a due reggimenti che i bombardamenti di questi giorni servono anche ad aprire la strada a una possibile operazione che potrebbe portare i soldati israeliani a entrare in Libano per attaccare Hezbollah. Non ha detto che ci sarà un’invasione di terra, ma ha fatto capire piuttosto chiaramente che Israele sta preparando e valutando questa possibilità. Il ministero della Salute libanese ha fatto sapere che negli attacchi di mercoledì sono state uccise 51 persone libanesi (tra cui anche un neonato) e ferite 223. Da lunedì, quando è iniziata la campagna di bombardamenti israeliani in corso sul Libano, sono state uccise quasi 600 persone, secondo i dati del governo, ritenuti affidabili. Come nei giorni precedenti, gli attacchi di Israele hanno colpito quelli che definisce obiettivi militari (cioè i luoghi in cui secondo l’esercito israeliano Hezbollah nasconde le armi). Mercoledì pomeriggio l’esercito israeliano ha detto di aver colpito «280 obiettivi» di Hezbollah, e in particolare di aver preso di mira basi e attrezzature dell’apparato di intelligence del gruppo libanese. In risposta Hezbollah ha lanciato decine di razzi in territorio israeliano, ma la maggior parte è stata intercettata dal sistema di difesa antiaereo. Mercoledì mattina un missile balistico lanciato da Hezbollah ha raggiunto per la prima volta lo spazio aereo sopra Tel Aviv, nel centro di Israele, facendo attivare le sirene antiaeree. È stato intercettato prima che riuscisse a raggiungere l’obiettivo e abbattuto in aria dalla difesa antiaerea. Non ci sono stati morti o feriti, ma è comunque una notizia notevole perché nessun missile di Hezbollah era mai arrivato così a sud in territorio israeliano. Israele ha detto in seguito di aver bombardato e distrutto la base da cui era partito, a Nafakhiyeh, nel sud del Libano. Secondo le dichiarazioni di Hezbollah l’obiettivo dell’attacco sarebbe dovuto essere il quartier generale del Mossad, l’agenzia di intelligence per l’estero di Israele, che si trova poco fuori da Tel Aviv. Il gruppo ha detto di aver lanciato il missile in risposta all’uccisione di un suo comandante, Ibrahim Muhammad Qubaisi, avvenuta ieri in un attacco aereo su un quartiere residenziale della capitale Beirut, in cui sono state uccise sei persone. L’esercito israeliano ha detto che delle decine di razzi lanciati questa mattina in territorio israeliano uno ha colpito una casa nella città di Safed, causando danni ma nessun ferito. Due persone sono state ferite lievemente in un attacco contro un kibbutz nel nord del paese. Gli scontri tra Israele ed Hezbollah vanno avanti ormai da quasi un anno, e cioè dall’inizio dell’invasione israeliana nella Striscia di Gaza. Tuttavia si sono intensificati dopo l’operazione di intelligence con cui Israele aveva fatto esplodere migliaia di cercapersone e walkie-talkie in possesso di Hezbollah, uccidendo almeno 30 persone. Da allora il governo e le autorità militari israeliane hanno iniziato a parlare con più insistenza della necessità di far rientrare nelle proprie case gli oltre 60mila israeliani sfollati dal nord del paese a causa dei continui scambi di missili fra Israele e Hezbollah. Finora comunque la leadership israeliana è stata piuttosto ambigua su come intende farlo. Mercoledì due brigate di riservisti israeliani sono state richiamate e inviate al confine con il Libano: secondo un comunicato dell’esercito saranno impiegate per combattere Hezbollah, proteggere i confini israeliani e permettere ai cittadini della zona di tornare nelle proprie case. I bombardamenti israeliani sul Libano degli ultimi due giorni hanno spinto decine di migliaia di persone a lasciare le proprie case nelle regioni più a sud per spostarsi in luoghi che ritengono più sicuri. Le Nazioni Unite hanno detto che gli attacchi degli ultimi cinque giorni hanno causato più di 90mila nuovi sfollati, che più di 40mila persone erano state ospitate nei suoi rifugi e che molte delle oltre 110mila persone che avevano lasciato le proprie case dall’ottobre scorso probabilmente hanno dovuto spostarsi di nuovo. Secondo il ministro degli Esteri libanese Abdallah Bou Habib invece il numero degli sfollati sarebbe molto più alto e in crescita, e si starebbe avvicinando a 500mila.             "
3,ilPost,2024-09-25,I Pirati sono al centro di una crisi politica in Repubblica Ceca,"In Repubblica Ceca il partito populista dell’ex primo ministro Andrej Babiš, nonché il principale dell’opposizione, ha vinto nettamente le elezioni regionali di venerdì e sabato scorsi: ANO, di estrema destra, che in ceco significa “sì” ed è l’acronimo di “Azione dei cittadini insoddisfatti”, ha vinto in 10 regioni su 13. I partiti che sostengono il governo di centrodestra di Petr Fiala hanno più o meno confermato i loro consensi, con l’eccezione dei Pirati (europeisti di centro) che sono andati malissimo. Per questa ragione, domenica il loro leader storico Ivan Bartoš si è dimesso. Martedì si è aperta una crisi di governo quando Fiala ha provato a licenziare Bartoš, che è anche un suo ministro, chiedendo ai Pirati di indicare un sostituto. Loro hanno accusato Fiala di volerli cacciare e hanno convocato un sondaggio tra i loro membri per lasciare il governo. Nonostante esprimano tre ministri, i Pirati hanno pochi seggi in parlamento: la loro uscita dall’esecutivo indebolirebbe la maggioranza di Fiala, senza però fargli mancare i numeri per la fiducia. Sarebbe diverso se venissero seguiti dal partito dei Sindaci e degli Indipendenti (STAN), che ha 33 seggi alla Camera e alle elezioni del 2021 si era presentato in coalizione con i Pirati. I dirigenti di STAN per ora sembrano propensi a non far cadere il governo. Secondo i Pirati, Fiala ha agito su pressione dell’ala del suo partito conservatore (ODS) che vorrebbe allearsi con Babiš dopo le elezioni generali dell’anno prossimo. Venerdì e sabato si votava anche per rinnovare un terzo degli 81 seggi del Senato: i ballottaggi saranno questo fine settimana, ma i candidati di ANO saranno in 19 dei 20 seggi che non sono stati assegnati al primo turno, dove il partito ha comunque già fatto eleggere due senatori. Al Parlamento Europeo ANO fa parte del gruppo di estrema destra Patrioti per l’Europa. I partiti della coalizione che appoggia Fiala, come detto, non sono andati particolarmente male né bene. Oltre all’ODS del primo ministro e STAN, fanno parte della coalizione i Cristiano-democratici (KDU-ČSL) e TOP09, un altro partito di centrodestra. Per i Pirati, invece, le regionali sono state disastrose: sono passati da 99 seggi a 3. Secondo il politologo Pavel Havlíček, si sono concentrati troppo sulla politica nazionale, trascurando temi e alleanze locali. Bartoš si è assunto la responsabilità del pessimo risultato, dimettendosi da leader del partito. Due giorni dopo è stato il protagonista della crisi di governo. Martedì mattina Fiala ha ricevuto Bartoš, che è ministro dello Sviluppo regionale e della Digitalizzazione. Dopo l’incontro Bartoš ha parlato di quali secondo lui avrebbero dovuto essere le immediate priorità per il governo. Poche ore dopo il primo ministro gli ha comunicato al telefono l’intenzione di rimuoverlo dall’incarico a partire dalla fine del mese: Bartoš si è sorpreso sia perché alla mattina Fiala non gliene aveva parlato sia per lo scarso preavviso. Il primo ministro, ha detto, lo ha avvisato delle sue intenzioni mezz’ora prima che la cosa diventasse di dominio pubblico. Fiala ha motivato la sua decisione dicendo che non era soddisfatto di come Bartoš aveva lavorato alla digitalizzazione dei permessi edili, ma che invece era stato contento dell’operato degli altri due ministri dei Pirati, Jan Lipavský (Esteri) e Michal Šalomoun (Produzione legislativa). C’è stata una certa confusione: mentre Fiala assicurava di non voler scaricare gli alleati, loro facevano una conferenza stampa dicendo che era l’esatto contrario, parlando di «tradimento». I Pirati hanno convocato una consultazione online che inizierà venerdì e finirà alle 20 di lunedì in cui potranno votare tutti gli iscritti. Le dichiarazioni dei loro principali esponenti – tra cui l’eurodeputata Markétka Gregorová, che a gennaio aveva sfidato Bartoš per la leadership del partito – indicano però esplicitamente che considerano chiusa l’esperienza. «Non lasciamo il governo, siamo stati cacciati», ha detto il capogruppo alla Camera, Jakub Michálek. La crisi politica, però, ha parzialmente spaccato i Pirati. Il ministro degli Esteri ha detto che asseconderebbe la decisione dei membri anche se non la condivide, ma poi uscirebbe dal partito. Il leader di STAN, Vít Rakušan, si è rammaricato della situazione: «Mi identifico con quello che [i Pirati] hanno detto, cioè che gli elettori vogliono soluzioni ai problemi». Mercoledì c’è un incontro tra Rakušan e Bartoš, che si è rifatto alla formula del 2021 «Insieme al governo, insieme all’opposizione». La vicepresidente di STAN ha chiarito però che non ritiene «ragionevole consegnare il paese ai populisti in questo momento». In Repubblica Ceca il potere di destituire un ministro, su richiesta del capo del governo, spetta al presidente della Repubblica, Petr Pavel. Pavel però si trova negli Stati Uniti e ha fatto sapere che incontrerà i leader della maggioranza lunedì. Nel frattempo Bartoš ha detto che considera i Pirati «ancora parte della coalizione» e ha chiesto di rinviare il Consiglio dei ministri di mercoledì, in cui dovrebbe venire discusso il bilancio statale che va presentato alla Camera entro fine settembre (verrà aumentato il deficit per i gravi allagamenti causati dalla tempesta Boris). Il nuovo o la nuova leader dei Pirati verranno invece eletti il 9 novembre. Per allora il partito potrebbe essere già passato all’opposizione."
